{
  "schemaVersion": "0.1.0",
  "fixtureId": "kaifuu-key-helper-authorization-denied",
  "helperResultId": "helper-result-key-helper-authorization-denied",
  "profileId": "019ed000-0000-7000-8000-profile00037",
  "helper": {
    "helperId": "kaifuu.fixture.remote-windows",
    "helperVersion": "0.1.0",
    "helperKind": "remoteWindowsHelper"
  },
  "capabilityLevel": "remoteWindows",
  "execution": {
    "mode": "remoteHelper",
    "platform": "windows-fixture",
    "bounded": true,
    "timeoutMs": 5000,
    "durationMs": 0,
    "networkAccess": false,
    "filesystemAccess": "localGameReadOnly"
  },
  "diagnostic": {
    "code": "helper_authorization_denied",
    "message": "synthetic remote Windows helper authorization is denied"
  },
  "redaction": {
    "status": "redacted",
    "redactedLogHash": "sha256:3434343434343434343434343434343434343434343434343434343434343434"
  },
  "secretRefs": [],
  "proofHashes": []
}
