{
  "schemaVersion": "0.1.0",
  "fixtureId": "kaifuu-key-helper-wine-unavailable",
  "helperResultId": "helper-result-key-helper-wine-unavailable",
  "profileId": "019ed000-0000-7000-8000-profile00037",
  "helper": {
    "helperId": "kaifuu.fixture.wine-local-windows",
    "helperVersion": "0.1.0",
    "helperKind": "wineLocalWindowsHelper"
  },
  "capabilityLevel": "wineLocal",
  "execution": {
    "mode": "platformHelper",
    "platform": "wine-fixture",
    "bounded": true,
    "timeoutMs": 5000,
    "durationMs": 0,
    "networkAccess": false,
    "filesystemAccess": "localGameReadOnly"
  },
  "diagnostic": {
    "code": "helper_unavailable",
    "message": "synthetic Wine helper is unavailable on this runner"
  },
  "redaction": {
    "status": "redacted",
    "redactedLogHash": "sha256:9999999999999999999999999999999999999999999999999999999999999999"
  },
  "secretRefs": [],
  "proofHashes": []
}
