{
  "schemaVersion": "0.1.0",
  "fixtureId": "kaifuu-key-helper-known-key-import",
  "helperResultId": "helper-result-key-helper-known-key-import",
  "profileId": "019ed000-0000-7000-8000-profile00037",
  "helper": {
    "helperId": "kaifuu.fixture.known-key-import",
    "helperVersion": "0.1.0",
    "helperKind": "knownKeyDatabaseImport"
  },
  "capabilityLevel": "localKeyImport",
  "execution": {
    "mode": "notExecuted",
    "platform": "fixture-local",
    "bounded": true,
    "timeoutMs": 1000,
    "durationMs": 0,
    "networkAccess": false,
    "filesystemAccess": "none"
  },
  "diagnostic": {
    "code": "success",
    "message": "synthetic known-key import produced only local secret refs"
  },
  "redaction": {
    "status": "redacted",
    "redactedLogHash": "sha256:7777777777777777777777777777777777777777777777777777777777777777"
  },
  "secretRefs": [
    {
      "requirementId": "siglus-secondary-key",
      "secretRef": "local-secret:fixture/siglus/imported-secondary-key",
      "materialKind": "fixedBytes",
      "bytes": 16,
      "validation": {
        "method": "decryptHeaderProof",
        "proofHash": "sha256:7777777777777777777777777777777777777777777777777777777777777777"
      }
    }
  ],
  "proofHashes": [
    {
      "method": "decryptHeaderProof",
      "proofHash": "sha256:7777777777777777777777777777777777777777777777777777777777777777"
    }
  ]
}
