{
  "schemaVersion": "0.1.0",
  "fixtureId": "kaifuu-xp3-helper-required",
  "helperResultId": "helper-result-xp3-helper-required",
  "profileId": "019ed000-0000-7000-8000-000000095004",
  "helper": {
    "helperId": "kaifuu.fixture.manual-entry",
    "helperVersion": "0.1.0",
    "helperKind": "manualKeyEntry"
  },
  "capabilityLevel": "manualEntry",
  "execution": {
    "mode": "notExecuted",
    "platform": "fixture-local",
    "bounded": true,
    "timeoutMs": 1000,
    "durationMs": 0,
    "networkAccess": false,
    "filesystemAccess": "none"
  },
  "diagnostic": {
    "code": "helper_required",
    "message": "synthetic XP3 helper-gated profile requires a local helper result before archive table access"
  },
  "redaction": {
    "status": "not_required",
    "redactedLogHash": "sha256:1010101010101010101010101010101010101010101010101010101010101010"
  },
  "secretRefs": [
    {
      "requirementId": "kirikiri-xp3-key-profile",
      "secretRef": "prompt:fixture/kirikiri/xp3-archive-password",
      "materialKind": "archivePassword"
    }
  ],
  "proofHashes": [
    {
      "method": "archiveIndexProof",
      "proofHash": "sha256:1111111111111111111111111111111111111111111111111111111111111111"
    }
  ]
}
